{
  "service": "homepi-hifi-serial",
  "status": "healthy",
  "checkedAt": "2026-05-27T16:00:00.000Z",
  "uptimeMs": 125000,
  "watchdogHealthy": true,
  "checks": [
    {
      "name": "serial_connection",
      "status": "pass",
      "message": "Serial device is connected.",
      "durationMs": 2,
      "data": {
        "device": "/dev/vHifi"
      }
    },
    {
      "name": "unix_socket",
      "status": "pass",
      "message": "Unix socket is accepting clients.",
      "durationMs": 1,
      "data": {
        "socketPath": "/run/homepi/hifi-serial.sock"
      }
    }
  ]
}
